{
  "schema_version": "1",
  "package": "axionvera-vault-contract",
  "target": "wasm32v1-none",
  "artifact_path": "target/wasm32v1-none/release/axionvera_vault_contract.wasm",
  "sha256": "e3b0c44298fc1c149afbf4c8996fb92427ae41e4649b934ca495991b7852b855",
  "build_timestamp": "2026-08-28T12:00:00Z",
  "source_commit": "a1b2c3d4e5f6a1b2c3d4e5f6a1b2c3d4e5f6a1b2"
}
